{
  "schema_version": "1.0",
  "id": "exp-0002",
  "hypothesis": "Raising pipeline depth should cut the mockflow latency objective at some area cost.",
  "source": {
    "git_sha": "a1b2c3d",
    "branch": "main",
    "dirty": false
  },
  "knobs": [
    {
      "name": "mockflow.pipeline_depth",
      "from": 2,
      "to": 4,
      "rationale": "deeper pipeline to chase the latency objective",
      "layer": "flow"
    }
  ],
  "outcome": {
    "status": "success",
    "metrics": {
      "latency_ns": 11.7,
      "passed": true
    },
    "metric_meta": {
      "latency_ns": {
        "direction": "min",
        "unit": "ns"
      }
    },
    "artifacts": [
      "mockflow.log"
    ]
  },
  "provenance": {
    "created": "2026-06-10T10:42:17+00:00",
    "tools": [
      {
        "name": "mockflow",
        "version": "0.1"
      }
    ],
    "agent": "dev-harness"
  }
}
